,movie_title,total
1037,pirate radio,Richard CurtisCharlie RoweComedy Drama MusicPhilip Seymour HoffmanTom Sturridge
1038,traffic,Steven SoderberghJacob VargasCrime Drama ThrillerMichael O'NeillJames Lew
1039,indiana jones and the last crusade,Steven SpielbergJulian GloverAction Adventure FantasyHarrison FordAlison Doody
1040,anna karenina,Joe WrightGuro Nagelhus SchiaDrama RomanceKelly MacdonaldMatthew Macfadyen
1041,chappie,Neill BlomkampSharlto CopleyAction Crime Drama Sci-Fi ThrillerHugh JackmanJose Pablo Cantillo
1042,the bone collector,Phillip NoyceAngelina Jolie PittCrime Drama Mystery ThrillerDenzel WashingtonLeland Orser
1043,panic room,David FincherDwight YoakamCrime Drama ThrillerKristen StewartMel Rodriguez
1044,the tooth fairy,Chuck BowmanLochlyn MunroHorror ThrillerP.J. SolesSteve Bacic
1045,three kings,David O. RussellJamie KennedyAction Adventure Comedy Drama WarJudy GreerMykelti Williamson
1046,child 44,Daniel EspinosaFares FaresCrime Drama ThrillerTom HardyMichael Nardone
1047,rat race,Jerry ZuckerDouglas HaaseAdventure ComedyCorinna HarneyVince Vieluf
1048,k-pax,Iain SoftleyJeff BridgesDrama Mystery Sci-FiKevin SpaceyAlfre Woodard
1049,kate & leopold,James MangoldNatasha LyonneComedy Fantasy RomanceHugh JackmanBradley Whitford
1050,bedazzled,Harold RamisFrances O'ConnorComedy Fantasy RomanceBrendan FraserBrian Doyle-Murray
1051,the cotton club,Francis Ford CoppolaBob HoskinsCrime Drama MusicNicolas CageFred Gwynne
1052,3:10 to yuma,James MangoldLogan LermanAdventure Crime Drama WesternChristian BaleGretchen Mol
1053,taken 3,Olivier MegatonDougray ScottAction ThrillerLiam NeesonJon Gries
1054,out of sight,Steven SoderberghAlbert BrooksCrime Drama Romance ThrillerDon CheadleKeith Hudson
1055,the cable guy,Ben StillerJaneane GarofaloComedy Drama ThrillerMatthew BroderickAndy Dick
1056,earth,Deepa MehtaGulshan GroverDrama Romance WarNandita DasEric Peterson
1057,dick tracy,Warren BeattyWarren BeattyAction Comedy Crime Music Romance ThrillerCharlie KorsmoSeymour Cassel
1058,the thomas crown affair,John McTiernanFaye DunawayCrime Romance ThrillerMark MargolisDenis Leary
1059,riding in cars with boys,Penny MarshallAdam GarciaBiography Comedy DramaRosie PerezAlissa Dean
1060,first blood,Ted KotcheffBrian DennehyAction Adventure DramaSylvester StalloneChris Mulkey
1061,solaris,Andrei TarkovskyAnatoliy SolonitsynDrama Mystery Sci-FiDonatas BanionisNatalya Bondarchuk
1062,happily n'ever after,Paul BolgerGeorge CarlinAdventure Animation Comedy Family FantasySarah Michelle GellarRob Paulsen
1063,mary reilly,Stephen FrearsBronagh GallagherDrama Horror Romance ThrillerJulia RobertsGeorge Cole
1064,my best friend's wedding,P.J. HoganChristopher MastersonComedy RomanceJulia RobertsRupert Everett
1065,america's sweethearts,Joe RothRainn WilsonComedy RomanceJulia RobertsLarry King
1066,insomnia,Christopher NolanMaura TierneyDrama Mystery ThrillerAl PacinoCrystal Lowe
1067,star trek: first contact,Jonathan FrakesAlfre WoodardAction Adventure Drama Sci-Fi ThrillerLeVar BurtonJonathan Frakes
1068,jonah hex,Jimmy HaywardBilly BlairAction Drama Fantasy Thriller WesternMichael FassbenderJulia Jones
1069,courage under fire,Edward ZwickMatt DamonAction Drama Mystery Thriller WarDenzel WashingtonScott Glenn
1070,liar liar,Tom ShadyacSwoosie KurtzComedy Fantasy RomanceMaura TierneyRandall 'Tex' Cobb
1071,the infiltrator,Brad FurmanAmy RyanBiography Crime Drama ThrillerJoseph GilgunOlympia Dukakis
1072,inchon,Terence YoungBen GazzaraDrama History WarLaurence OlivierJacqueline Bisset
1073,the flintstones,Brian LevantElizabeth PerkinsComedy Family FantasyJonathan WintersHarvey Korman
1074,taken 2,Olivier MegatonLuke GrimesAction Crime ThrillerLiam NeesonD.B. Sweeney
1075,scary movie 3,David ZuckerPamela AndersonComedyRegina HallJenny McCarthy
1076,miss congeniality,Donald PetrieWendy Raquel RobinsonAction Comedy Crime RomanceCandice BergenHeather Burns
1077,journey to the center of the earth,Eric BrevigBrendan FraserAction Adventure Family Fantasy Sci-FiJosh HutchersonAnita Briem
1078,the princess diaries 2: royal engagement,Garry MarshallRaven-SymonéComedy Family RomanceAnne HathawayHector Elizondo
1079,the pelican brief,Alan J. PakulaJulia RobertsCrime Drama Mystery ThrillerDenzel WashingtonTony Goldwyn
1080,the client,Joel SchumacherAnthony LaPagliaCrime Drama Mystery ThrillerBradley WhitfordBrad Renfro
1081,the bucket list,Rob ReinerNoel GugliemiAdventure Comedy DramaMorgan FreemanSean Hayes
1082,patriot games,Phillip NoycePolly WalkerAction ThrillerHarrison FordPatrick Bergin
1083,monster-in-law,Robert LuketicJane FondaComedy RomanceAdam ScottElaine Stritch
1084,prisoners,Denis VilleneuveJake GyllenhaalCrime Drama Mystery ThrillerHugh JackmanDylan Minnette
1085,training day,Antoine FuquaSnoop DoggCrime Drama ThrillerDenzel WashingtonTom Berenger
1086,galaxy quest,Dean ParisotEnrico ColantoniAdventure Comedy Sci-FiAlan RickmanRobin Sachs
1087,scary movie 2,Keenen Ivory WayansVeronica CartwrightComedyNatasha LyonneAndy Richter
1088,the muppets,James BobinEric JacobsonAdventure Comedy Family MusicalBill CobbsSteve Whitmire
1089,blade,Stephen NorringtonTraci LordsAction HorrorSanaa LathanUdo Kier
1090,coach carter,Thomas CarterRick GonzalezDrama SportChanning TatumRobert Ri'chard
1091,changing lanes,Roger MichellMatt MalloyDrama ThrillerSydney PollackBruce Altman
1092,anaconda,Luis LlosaEric StoltzAction Adventure Horror ThrillerFrank WelkerKari Wuhrer
1093,coyote ugly,David McNallyTyra BanksComedy Drama Music RomanceAdam GarciaIzabella Miko
1094,love actually,Richard CurtisLiam NeesonComedy Drama RomanceColin FirthKris Marshall
1095,a bug's life,John LasseterMadeline KahnAdventure Animation Comedy Family FantasyKevin SpaceyJohn Ratzenberger
1096,from hell,Albert HughesJason FlemyngHorror Mystery ThrillerJohnny DeppIan Richardson
1097,the specialist,Luis LlosaRod SteigerAction Crime Drama Romance ThrillerSylvester StalloneEmilio Estefan Jr.
1098,tin cup,Ron SheltonCheech MarinComedy Drama Romance SportDon JohnsonRene Russo
1099,"yours, mine and ours",Melville ShavelsonTom BosleyComedy FamilyLucille BallTim Matheson
1100,kicking & screaming,Jesse DylanWill FerrellComedy Family Romance SportJosh HutchersonRobert Duvall
1101,the hitchhiker's guide to the galaxy,Garth JenningsKelly MacdonaldAdventure Comedy Sci-FiZooey DeschanelThomas Lennon
1102,fat albert,Joel ZwickNick ZanoComedy Family Fantasy RomanceDania RamirezAlice Greczyn
1103,resident evil: extinction,Russell MulcahyMike EppsAction Horror Sci-Fi ThrillerMilla JovovichJames Tumminia
1104,blended,Frank CoraciAdam SandlerComedy RomanceBella ThorneJoel McHale
1105,last holiday,Wayne WangAlicia WittAdventure Comedy DramaLL Cool JTimothy Hutton
1106,the river wild,Curtis HansonGlenn MorshowerAction Adventure Crime ThrillerMeryl StreepWilliam Lucking
1107,the indian in the cupboard,Frank OzVincent KartheiserDrama Family FantasySteve CooganDavid Keith
1108,savages,Oliver StoneShea WhighamCrime Drama ThrillerDemián BichirGary Stretch
1109,cellular,David R. EllisValerie CruzAction Crime ThrillerRichard BurgiWill Beinbrink
1110,johnny english,Peter HowittNatalie ImbrugliaAction Adventure ComedyKevin McNallyBen Miller
1111,the ant bully,John A. DavisMeryl StreepAdventure Animation Comedy Family FantasyNicolas CageJulia Roberts
1112,dune,David LynchJürgen ProchnowAction Adventure Sci-FiVirginia MadsenJosé Ferrer
1113,across the universe,Julie TaymorT.V. CarpioDrama Fantasy Musical RomanceJim SturgessRobert Clohessy
1114,revolutionary road,Sam MendesKate WinsletDrama RomanceLeonardo DiCaprioJoe Komara
1115,16 blocks,Richard DonnerDavid ZayasAction Crime Drama ThrillerBruce WillisSasha Roiz
1116,babylon a.d.,Mathieu KassovitzCharlotte RamplingAction Adventure Sci-Fi ThrillerVin DieselDavid Belle
1117,the glimmer man,John GrayBob GuntonAction Comedy Crime Drama ThrillerAlexa PenaVegaKeenen Ivory Wayans
1118,multiplicity,Harold RamisBrian Doyle-MurrayComedy Romance Sci-FiJohn de LancieObba Babatundé
1119,aliens in the attic,John SchultzCarter JenkinsAdventure Comedy Family Fantasy Sci-FiMalese JowTim Meadows
1120,the pledge,Sean PennAdrien DorvalCrime Drama Mystery ThrillerCostas MandylorNels Lennarson
1121,the producers,Susan StromanWill FerrellComedy MusicalJon LovitzMatthew Broderick
1122,dredd,Pete TravisJason CopeAction Sci-FiWood HarrisRakie Ayola
1123,the phantom,Simon WincerTreat WilliamsAction Adventure Comedy FantasyCary-Hiroyuki TagawaKristy Swanson
1124,all the pretty horses,Billy Bob ThorntonHenry ThomasDrama Romance WesternMatt DamonSam Shepard
1125,nixon,Oliver StoneBob HoskinsBiography Drama HistoryAnthony HopkinsJoan Allen
1126,the ghost writer,Roman PolanskiOlivia WilliamsMystery ThrillerJim BelushiTimothy Hutton
1127,deep rising,Stephen SommersJason FlemyngAction Adventure Horror Sci-FiDjimon HounsouWes Studi
1128,miracle at st. anna,Spike LeeOmari HardwickAction Crime Drama Thriller WarJoseph Gordon-LevittLaz Alonso
1129,curse of the golden flower,Yimou ZhangYe LiuDrama RomanceLi GongMan Li
1130,bangkok dangerous,Danny PangCharlie YeungAction Crime ThrillerNicolas CageJames With
1131,big trouble,Barry SonnenfeldJaneane GarofaloComedy Crime ThrillerZooey DeschanelOmar Epps
1132,love in the time of cholera,Mike NewellGiovanna MezzogiornoDrama RomanceMarcela MarUnax Ugalde
1133,the returned            ,unknownClotilde HesmeDrama Fantasy Horror MysteryPierre PerrierCéline Sallette
1134,shadow conspiracy,George P. CosmatosBen GazzaraAction ThrillerSam WaterstonNicholas Turturro
1135,johnny english reborn,Oliver ParkerTim McInnernyAction Adventure Comedy CrimeDaniel KaluuyaTogo Igawa
1136,foodfight!,Lawrence KasanoffLarry MillerAction Animation Comedy Family FantasyJerry StillerHarvey Fierstein
1137,argo,Ben AffleckScoot McNairyBiography Drama History ThrillerClea DuVallTate Donovan
1138,the fugitive,Andrew DavisDaniel RoebuckAction Adventure Crime Drama Mystery ThrillerHarrison FordSela Ward
1139,the bounty hunter,Andy TennantDorian MissickAction Comedy RomanceGerard ButlerPeter Greene
1140,sleepers,Barry LevinsonBrad PittCrime Drama ThrillerRobert De NiroMinnie Driver
1141,rambo: first blood part ii,George P. CosmatosJulia NicksonAction Adventure Thriller WarSylvester StalloneMartin Kove
1142,the juror,Brian GibsonDemi MooreDrama ThrillerJoseph Gordon-LevittAnne Heche
1143,pinocchio,Norman FergusonDickie JonesAnimation Family Fantasy MusicalMel BlancCliff Edwards
1144,heaven's gate,Michael CiminoSam WaterstonAdventure Drama WesternJeff BridgesIsabelle Huppert
1145,underworld: evolution,Len WisemanTony CurranAction Adventure Fantasy Sci-Fi ThrillerSophia MylesDerek Jacobi
1146,victor frankenstein,Paul McGuiganSpencer WildingDrama Horror Sci-Fi ThrillerDaniel RadcliffeDaniel Mays
1147,finding forrester,Gus Van SantRob BrownDramaF. Murray AbrahamMichael Nouri
1148,28 days,Betty ThomasViggo MortensenComedy DramaSteve BuscemiElizabeth Perkins
1149,unleashed,Louis LeterrierJet LiAction Crime Drama ThrillerMorgan FreemanBob Hoskins
1150,the sweetest thing,Roger KumbleLillian AdamsComedy RomanceJudith ChapmanChelsea Bond
1151,the firm,Sydney PollackHolly HunterDrama Mystery ThrillerTom CruiseWilford Brimley
1152,charlie st. cloud,Burr SteersCharlie TahanDrama Fantasy RomanceAugustus PrewValerie Tian
1153,the mechanic,Simon WestTony GoldwynAction Crime ThrillerJason StathamMini Anden
1154,21 jump street,Phil LordDax FlameAction Comedy CrimeChanning TatumRob Riggle
1155,notting hill,Roger MichellClarke PetersComedy Drama RomanceJulia RobertsDylan Moran
1156,chicken run,Peter LordMiranda RichardsonAdventure Animation Comedy Drama FamilyImelda StauntonJulia Sawalha
1157,along came polly,John HamburgMasi OkaComedy RomancePhilip Seymour HoffmanDebra Messing
1158,boomerang,Reginald HudlinEartha KittComedy Drama RomanceJohn WitherspoonGeoffrey Holder
1159,the heat,Paul FeigWilliam XifarasAction Comedy CrimeMichael RapaportDemián Bichir
1160,cleopatra,Joseph L. MankiewiczRichard BurtonBiography Drama History RomanceMartin LandauRoddy McDowall
1161,here comes the boom,Frank CoraciReggie LeeAction Comedy SportSalma HayekCharice
1162,high crimes,Carl FranklinAdam ScottCrime Drama Mystery ThrillerMorgan FreemanBruce Davison
1163,the mirror has two faces,Barbra StreisandAustin PendletonComedy Drama RomanceJeff BridgesMimi Rogers
1164,the mothman prophecies,Mark PellingtonWill PattonDrama Horror Mystery ThrillerDebra MessingDavid Eigenberg
1165,brüno,Larry CharlesElton JohnComedyBonoSlash
1166,licence to kill,John GlenTalisa SotoAction Adventure ThrillerRobert DaviAnthony Zerbe
1167,red riding hood,Catherine HardwickeBilly BurkeFantasy Horror Mystery ThrillerGary OldmanVirginia Madsen
1168,15 minutes,John HerzfeldCharlize TheronAction Crime Drama ThrillerRobert De NiroKelsey Grammer
1169,super mario bros.,Annabel JankelFisher StevensAdventure Comedy Family Fantasy Sci-FiBob HoskinsFiona Shaw
1170,lord of war,Andrew NiccolJeremy CrutchleyCrime Drama ThrillerNicolas CageJared Burke
1171,hero,Yimou ZhangTony Chiu Wai LeungAction Adventure HistoryJet LiMaggie Cheung
1172,one for the money,Julie Anne RobinsonDebbie ReynoldsAction Comedy Crime Romance ThrillerFisher StevensPatrick Fischler
1173,the interview,Evan GoldbergRandall ParkComedyJames FrancoAnders Holm
1174,the warrior's way,Sngmoo LeeDong-gun JangAction Fantasy WesternTony CoxJed Brophy
1175,mchale's navy            ,unknownGavin MacLeodComedy WarTim ConwayBob Hastings
1176,micmacs,Jean-Pierre JeunetDany BoonAction Comedy CrimeOmar SyAndré Dussollier
1177,8 mile,Curtis HansonOmar Benson MillerDrama MusicMekhi PhiferEvan Jones
1178,animal kingdom: let's go ape,Jamel DebbouzeYoussef HajdiAdventure Animation Comedy FamilyJamel DebbouzeMélissa Theuriau
1179,a knight's tale,Brian HelgelandRufus SewellAction Adventure RomanceHeath LedgerBérénice Bejo
1180,the medallion,Gordon ChanLee EvansAction Comedy FantasyJulian SandsAnthony Chau-Sang Wong
1181,the sixth sense,M. Night ShyamalanHaley Joel OsmentDrama Mystery ThrillerBruce WillisOlivia Williams
1182,man on a ledge,Asger LethMandy GonzalezAction Crime ThrillerRobert ClohessyJ. Smith-Cameron
1183,the big year,David FrankelKevin PollakComedyJoel McHaleJoBeth Williams
1184,the karate kid,John G. AvildsenWilliam ZabkaAction Drama Family SportMartin KoveWilliam Bassett
1185,american hustle,David O. RussellChristian BaleCrime DramaJennifer LawrenceBradley Cooper
1186,the proposal,Anne FletcherDenis O'HareComedy Drama RomanceRyan ReynoldsCraig T. Nelson
1187,double jeopardy,Bruce BeresfordAnnabeth GishCrime Mystery ThrillerBruce GreenwoodBruce Campbell
1188,back to the future part ii,Robert ZemeckisJeffrey WeissmanAdventure Comedy Sci-FiLea ThompsonThomas F. Wilson
1189,lucy,Luc BessonMorgan FreemanAction Sci-Fi ThrillerScarlett JohanssonAmr Waked
1190,fifty shades of grey,Sam Taylor-JohnsonLuke GrimesDrama RomanceJennifer EhleCallum Rennie
1191,spy kids 3-d: game over,Robert RodriguezSalma HayekAction Adventure Comedy Family Sci-FiSylvester StalloneAlexa PenaVega
1192,a time to kill,Joel SchumacherMatthew McConaugheyCrime Drama ThrillerKevin SpaceyOliver Platt
1193,cheaper by the dozen,Shawn LevyAlyson StonerComedy FamilyTom WellingBonnie Hunt
1194,lone survivor,Peter BergScott ElrodAction Biography Drama Thriller WarJerry FerraraDan Bilzerian
1195,a league of their own,Penny MarshallLori PettyComedy Drama SportTom HanksRosie O'Donnell
1196,the conjuring 2,James WanFrances O'ConnorHorror Mystery ThrillerJavier BotetRobin Atkin Downes
1197,the social network,David FincherDustin FitzsimonsBiography DramaAndrew GarfieldMarcella Lentz-Pope
1198,he's just not that into you,Ken KwapisSabrina RevelleComedy Drama RomanceCarmen PerezSachiko Ishida
1199,scary movie 4,David ZuckerCarmen ElectraComedyBeau MirchoffRegina Hall
1200,scream 3,Wes CravenRoger JacksonHorror MysteryKelly RutherfordNancy O'Dell
1201,back to the future part iii,Robert ZemeckisJeffrey WeissmanAdventure Comedy Sci-Fi WesternLea ThompsonThomas F. Wilson
1202,get hard,Etan CohenAlison BrieComedy CrimeWill FerrellCraig T. Nelson
1203,bram stoker's dracula,Francis Ford CoppolaAnthony HopkinsFantasy Horror RomanceKeanu ReevesGary Oldman
1204,julie & julia,Nora EphronMary Lynn RajskubBiography Drama RomanceMeryl StreepVanessa Ferlito
1205,42,Brian HelgelandChristopher MeloniBiography Drama SportHarrison FordNicole Beharie
1206,the talented mr. ripley,Anthony MinghellaMatt DamonCrime Drama ThrillerPhilip Seymour HoffmanJack Davenport
1207,dumb and dumber to,Bobby FarrellyKathleen TurnerComedyBill MurrayRob Riggle
1208,eight below,Frank MarshallBruce GreenwoodAdventure Drama FamilyPaul WalkerWendy Crewson
1209,the intern,Nancy MeyersAnne HathawayComedy DramaRobert De NiroRene Russo
1210,ride along 2,Tim StoryNadine VelazquezAction ComedyOlivia MunnBruce McGill
1211,the last of the mohicans,Michael MannTerry KinneyAction Adventure Drama Romance WarWes StudiEric Schweig
1212,ray,Taylor HackfordCurtis ArmstrongBiography Drama MusicBokeem WoodbineHarry Lennix
1213,sin city,Frank MillerPowers BootheCrime ThrillerRosario DawsonJason Douglas
1214,vantage point,Pete TravisEdgar RamírezCrime Drama Mystery ThrillerDennis QuaidWilliam Hurt
1215,"i love you, man",John HamburgJon FavreauComedy RomanceJ.K. SimmonsJane Curtin
1216,shallow hal,Bobby FarrellyBruce McGillComedy Drama Fantasy RomanceJason AlexanderSusan Ward
1217,jfk,Oliver StoneJay O. SandersDrama History ThrillerSally KirklandCheryl Penland
1218,big momma's house 2,John WhitesellNia LongComedy CrimeChloë Grace MoretzMarisol Nichols
1219,the mexican,Gore VerbinskiBrad PittAdventure Comedy Crime RomanceJ.K. SimmonsJulia Roberts
1220,unbroken,Angelina Jolie PittJack O'ConnellBiography Drama Sport WarFinn WittrockAlex Russell
1221,17 again,Burr SteersHunter ParrishComedy Drama Family Fantasy RomanceMatthew PerryThomas Lennon
1222,the other woman,Nick CassavetesKate UptonComedy RomanceDon JohnsonDavid Thornton
1223,the final destination,David R. EllisAndrew FiscellaHorrorKrista AllenShantel VanSanten
1224,bridge of spies,Steven SpielbergMark RylanceDrama History ThrillerTom HanksAmy Ryan
1225,behind enemy lines,John MooreDavid KeithAction Drama Thriller WarJoaquim de AlmeidaSam Jaeger
1226,get him to the greek,Nicholas StollerMario LopezComedy MusicPinkLino Facioli
1227,shall we dance,Peter ChelsomNick CannonComedy Drama RomanceLisa Ann WalterOmar Benson Miller
1228,small soldiers,Joe DanteDenis LearyAction Adventure Comedy Family Sci-FiKirsten DunstRobert Picardo
1229,spawn,Mark A.Z. DippéFrank WelkerAction HorrorMichael Jai WhiteMiko Hughes
1230,the count of monte cristo,Kevin ReynoldsJames FrainAction Adventure Drama Romance ThrillerHenry CavillMichael Wincott
1231,the lincoln lawyer,Brad FurmanMargarita LevievaCrime Drama ThrillerMatthew McConaugheyFrances Fisher
1232,unknown,Jaume Collet-SerraFrank LangellaAction Mystery ThrillerLiam NeesonAidan Quinn
1233,the prestige,Christopher NolanHugh JackmanDrama Mystery Sci-Fi ThrillerChristian BaleScarlett Johansson
1234,horrible bosses 2,Sean AndersChristoph WaltzComedy CrimeKevin SpaceyLindsay Sloane
1235,escape from planet earth,Cal BrunkerPaul ScheerAdventure Animation Comedy Family Sci-FiBrendan FraserJonathan Morgan Heit
1236,apocalypto,Mel GibsonDalia HernándezAction Adventure Drama ThrillerRudy YoungbloodJonathan Brewer
1237,the living daylights,John GlenDesmond LlewelynAction Adventure ThrillerJoe Don BakerArt Malik
1238,predators,Nimród AntalAlice BragaAction Adventure Sci-Fi ThrillerTopher GraceDerek Mears
1239,legal eagles,Ivan ReitmanDebra WingerComedy Crime RomanceBrian DennehyRoscoe Lee Browne
1240,secret window,David KoeppCharles S. DuttonMystery ThrillerJohnny DeppTimothy Hutton
1241,the lake house,Alejandro AgrestiDylan WalshDrama Fantasy RomanceKeanu ReevesEbon Moss-Bachrach
1242,the skeleton key,Iain SoftleyDeneen TylerHorror Mystery ThrillerGena RowlandsJoy Bryant
1243,the odd life of timothy green,Peter HedgesOdeya RushComedy Drama Family FantasyJennifer GarnerCommon
1244,made of honor,Paul WeilandBeau GarrettComedy RomanceBusy PhilippsKevin Sussman
1245,jersey boys,Clint EastwoodSteve SchirripaBiography Drama Music MusicalJohnny CannizzaroScott Vance
1246,the rainmaker,Francis Ford CoppolaDean StockwellCrime Drama ThrillerMatt DamonVirginia Madsen
1247,gothika,Mathieu KassovitzCharles S. DuttonHorror Mystery ThrillerRobert Downey Jr.Bernard Hill
1248,amistad,Steven SpielbergMorgan FreemanDrama HistoryAnthony HopkinsMatthew McConaughey
1249,medicine man,John McTiernanJosé WilkerAdventure Drama RomanceLorraine BraccoSean Connery
1250,aliens vs. predator: requiem,Colin StrauseJohnny LewisAction Horror Sci-Fi ThrillerSam TrammellIan Whyte
1251,ri¢hie ri¢h,Donald PetrieJohn LarroquetteComedy FamilyMacaulay CulkinJonathan Hyde
1252,autumn in new york,Joan ChenSam TrammellDrama RomanceJ.K. SimmonsElaine Stritch
1253,music and lyrics,Marc LawrenceScott PorterComedy Music RomanceBrad GarrettHaley Bennett
1254,paul,Greg MottolaNelson AscencioAdventure Comedy Sci-FiBobby LeeJeremy Owen
1255,the guilt trip,Anne FletcherTom VirtueComedy DramaMiriam MargolyesJulene Renee
1256,scream 4,Wes CravenAimee TeegardenHorror MysteryAlison BrieShenae Grimes-Beech
1257,8mm,Joel SchumacherChris BauerMystery ThrillerNicolas CageAnthony Heald
1258,the doors,Oliver StoneKevin DillonBiography Drama Music MusicalMichael WincottKathleen Quinlan
1259,sex tape,Jake KasdanRandall ParkComedyJames WilcoxNat Faxon
1260,hanging up,Diane KeatonCelia WestonComedy DramaAdam ArkinJesse James
1261,final destination 5,Steven QualeJacqueline MacInnes WoodHorrorEmma BellCourtney B. Vance
1262,mickey blue eyes,Kelly MakinBurt YoungComedy Crime RomanceJeanne TripplehornVincent Pastore
1263,pay it forward,Mimi LederHaley Joel OsmentDramaKevin SpaceyAngie Dickinson
1264,fever pitch,Bobby FarrellyKaDee StricklandComedy Drama Romance SportJimmy FallonIone Skye
1265,arthur            ,unknownMelissa AltroAnimation Comedy FamilyBruce DinsmoreDaniel Brochu
1266,drillbit taylor,Steven BrillShaun WeissComedy DramaLisa Ann WalterMatt Walsh
1267,a million ways to die in the west,Seth MacFarlaneCharlize TheronComedy WesternLiam NeesonSeth MacFarlane
1268,the shadow,Russell MulcahyPeter BoyleAction Adventure Crime Fantasy Mystery ThrillerJonathan WintersJohn Kapelos
1269,extremely loud & incredibly close,Stephen DaldryThomas HornAdventure Drama MysteryTom HanksStephen Henderson
1270,morning glory,Roger MichellPatti D'ArbanvilleComedy Drama RomanceNoah BeanVanessa Aspillaga
1271,get rich or die tryin',Jim SheridanBill DukeBiography Crime Drama Music50 CentMarc John Jefferies
1272,the art of war,Christian DuguayCary-Hiroyuki TagawaAction Adventure Crime ThrillerMichael BiehnAnne Archer
1273,rent,Chris ColumbusDavid FineDrama Musical RomanceRosario DawsonJesse L. Martin
1274,bless the child,Chuck RussellJimmy SmitsCrime Drama Horror ThrillerRufus SewellAngela Bettis
1275,the out-of-towners,Sam WeismanValerie PerriComedyOliver HudsonCarlease Burke
1276,the island of dr. moreau,John FrankenheimerTemuera MorrisonHorror Sci-Fi ThrillerMarlon BrandoMarco Hofschneider
1277,the musketeer,Peter HyamsJustin ChambersAction Adventure RomanceCatherine DeneuveStephen Rea
1278,the other boleyn girl,Justin ChadwickScarlett JohanssonBiography Drama History RomanceNatalie PortmanBenedict Cumberbatch
1279,sweet november,Pat O'ConnorCharlize TheronDrama RomanceKeanu ReevesFrank Langella
1280,the reaping,Stephen HopkinsAndrea FrankleHorror ThrillerStephen ReaWilliam Ragsdale
1281,mean streets,Martin ScorseseDavid CarradineCrime Drama Romance ThrillerRobert De NiroDavid Proval
1282,renaissance man,Penny MarshallCliff RobertsonComedy DramaEd Begley Jr.Lillo Brancato
1283,colombiana,Olivier MegatonCallum BlueAction Crime Drama ThrillerJordi MollàJesse Borrego
1284,the magic sword: quest for camelot,Frederik Du ChauJaleel WhiteAdventure Animation Comedy Drama Family Fantasy MusicalGary OldmanEric Idle
1285,city by the sea,Michael Caton-JonesJames FrancoCrime Drama Mystery ThrillerRobert De NiroJohn Doman
1286,at first sight,Irwin WinklerNathan LaneDrama RomanceMira SorvinoSteven Weber
1287,torque,Joseph KahnJay HernandezAction Comedy CrimeDane CookChristina Milian
1288,city hall,Harold BeckerMartin LandauDrama ThrillerAl PacinoBridget Fonda
1289,showgirls,Paul VerhoevenElizabeth BerkleyDramaBobbie PhillipsRobert Davi
1290,marie antoinette,Sofia CoppolaShirley HendersonBiography Drama History RomanceKirsten DunstRip Torn
1291,kiss of death,Barbet SchroederMichael RapaportAction Crime ThrillerNicolas CagePhilip Baker Hall
1292,get carter,Stephen KayMiranda RichardsonAction Crime Drama ThrillerSylvester StalloneLauren Lee Smith
1293,the impossible,J.A. BayonaGeraldine ChaplinDrama ThrillerNaomi WattsOaklee Pendergast
1294,ishtar,Elaine MayWarren BeattyAction Adventure Comedy Music ThrillerCarol KaneIsabelle Adjani
1295,fantastic mr. fox,Wes AndersonMeryl StreepAdventure Animation Comedy Crime FamilyBill MurrayHelen McCrory
1296,life or something like it,Stephen HerekStockard ChanningComedy RomanceAngelina Jolie PittJames Gammon
1297,memoirs of an invisible man,John CarpenterMichael McKeanComedy Romance Sci-Fi ThrillerRichard EpcarPatricia Heaton
1298,amélie,Jean-Pierre JeunetJamel DebbouzeComedy RomanceMathieu KassovitzIsabelle Nanty
1299,new york minute,Dennie GordonBob SagetComedy Crime Family RomanceMary-Kate OlsenRiley Smith
1300,alfie,Charles ShyerNia LongComedy Drama RomanceOmar EppsJane Krakowski
1301,big miracle,Ken KwapisTim Blake NelsonBiography Drama RomanceTed DansonAndrew Daly
1302,the deep end of the ocean,Ulu GrosbardTreat WilliamsDramaAlexa PenaVegaJonathan Jackson
1303,feardotcom,William MaloneJeffrey CombsCrime Horror ThrillerNatascha McElhoneUdo Kier
1304,cirque du freak: the vampire's assistant,Paul WeitzSalma HayekAction Adventure Fantasy ThrillerJosh HutchersonPatrick Fugit
1305,victor frankenstein,Paul McGuiganSpencer WildingDrama Horror Sci-Fi ThrillerDaniel RadcliffeDaniel Mays
1306,duplex,Danny DeVitoAmber VallettaComedyJustin TherouxHarvey Fierstein
