,movie_title,total
2389,fear and loathing in las vegas,Terry GilliamMichael JeterAdventure Comedy DramaJohnny DeppEllen Barkin
2390,the invention of lying,Ricky GervaisTina FeyComedy Fantasy RomanceJennifer GarnerMartin Starr
2391,neighbors,Nicholas StollerCarla GalloComedyCraig RobertsIke Barinholtz
2392,the mask,Chuck RussellAmy YasbeckAction Comedy Crime FantasyPeter GreeneReg E. Cathey
2393,big,Penny MarshallJon LovitzComedy Drama Family Fantasy RomanceTom HanksJohn Heard
2394,borat: cultural learnings of america for make benefit glorious nation of kazakhstan,Larry CharlesKen DavitianComedyLuenellChester
2395,legally blonde,Robert LuketicRaquel WelchComedy RomanceLinda CardelliniAlanna Ubach
2396,star trek iii: the search for spock,Leonard NimoyNichelle NicholsAction Adventure Sci-FiLeonard NimoyWalter Koenig
2397,the exorcism of emily rose,Scott DerricksonColm FeoreDrama Horror ThrillerTom WilkinsonJR Bourne
2398,deuce bigalow: male gigolo,Mike MitchellEddie GriffinComedy RomanceAmy PoehlerBree Turner
2399,left behind,Vic ArmstrongLea ThompsonAction Drama Fantasy Mystery ThrillerNicolas CageQuinton Aaron
2400,the family stone,Thomas BezuchaPaul SchneiderComedy Drama RomanceCraig T. NelsonTyrone Giordano
2401,barbershop 2: back in business,Kevin Rodney SullivanSean Patrick ThomasComedy DramaHarry LennixKenan Thompson
2402,bad santa,Terry ZwigoffTony CoxComedy Crime DramaBernie MacAlex Borstein
2403,austin powers: international man of mystery,Jay RoachCharles NapierComedy CrimeWill FerrellRobert Wagner
2404,my big fat greek wedding 2,Kirk JonesLouis MandylorComedy Family RomanceNia VardalosJoey Fatone
2405,diary of a wimpy kid: rodrick rules,David BowersRachael HarrisComedy FamilyZachary GordonFran Kranz
2406,predator,John McTiernanBill DukeAction Horror Sci-FiShane BlackCarl Weathers
2407,amadeus,Milos FormanF. Murray AbrahamBiography Drama History MusicJeffrey JonesTom Hulce
2408,prom night,Nelson McCormickScott PorterHorror MysteryMing-Na WenCollins Pennie
2409,mean girls,Mark WatersAmy PoehlerComedyTina FeyNeil Flynn
2410,under the tuscan sun,Audrey WellsLindsay DuncanComedy Drama RomanceRaoul BovaMario Monicelli
2411,gosford park,Robert AltmanBob BalabanDrama MysteryKristin Scott ThomasTom Hollander
2412,the o.c.            ,unknownMelinda ClarkeComedy Drama RomancePeter GallagherTate Donovan
2413,peggy sue got married,Francis Ford CoppolaKathleen TurnerComedy Drama Fantasy RomanceNicolas CageJoan Allen
2414,birdman or (the unexpected virtue of ignorance),Alejandro G. IñárrituNaomi WattsComedy Drama RomanceEmma StoneMerritt Wever
2415,blue jasmine,Woody AllenCharlie TahanDramaSally HawkinsAndrew Dice Clay
2416,united 93,Paul GreengrassDavid Alan BascheDrama History ThrillerChristian ClemensonSusan Blommaert
2417,honey,Bille WoodruffMekhi PhiferDrama Music RomanceChristian MonzonRomeo Miller
2418,glory,Edward ZwickMorgan FreemanDrama History WarDenzel WashingtonMatthew Broderick
2419,spy hard,Rick FriedbergBarry BostwickAction ComedyHulk HoganNicollette Sheridan
2420,the fog,John CarpenterHal HolbrookFantasy HorrorJamie Lee CurtisJanet Leigh
2421,soul surfer,Sean McNamaraChris BrochuBiography Drama Family SportDennis QuaidCraig T. Nelson
2422,catch-22,Mike NicholsBob BalabanComedy Drama WarBob NewhartMartin Balsam
2423,observe and report,Jody HillCelia WestonComedy Crime DramaCollette WolfeDan Bakkedahl
2424,conan the destroyer,Richard FleischerOlivia d'AboAction Adventure FantasyMakoGrace Jones
2425,raging bull,Martin ScorseseCathy MoriartyBiography Drama SportRobert De NiroFrank Vincent
2426,love happens,Brandon CampSasha AlexanderDrama RomanceJudy GreerFrances Conroy
2427,young sherlock holmes,Barry LevinsonRoger Ashton-GriffithsAdventure Fantasy Mystery ThrillerNicholas RoweFreddie Jones
2428,fame,Kevin TancharoenKay PanabakerComedy Drama Musical RomanceKelsey GrammerMegan Mullally
2429,127 hours,Danny BoyleTreat WilliamsAdventure Biography Drama ThrillerJames FrancoKate Burton
2430,small time crooks,Woody AllenJon LovitzComedy CrimeWoody AllenMichael Rapaport
2431,center stage,Nicholas HytnerSusan May PrattDrama Music RomanceAmanda SchullEthan Stiefel
2432,love the coopers,Jessie NelsonAlex BorsteinComedyOlivia WildeTimothée Chalamet
2433,catch that kid,Bart FreundlichCorbin BleuComedy CrimeKristen StewartKevin G. Schmidt
2434,life as a house,Irwin WinklerHayden ChristensenDramaIan SomerhalderKristin Scott Thomas
2435,steve jobs,Danny BoyleMichael FassbenderBiography DramaKate WinsletMichael Stuhlbarg
2436,"i love you, beth cooper",Chris ColumbusMarie AvgeropoulosComedy RomanceAlan RuckShawn Roberts
2437,youth in revolt,Miguel ArtetaAri GraynorComedy Drama RomanceSteve BuscemiFred Willard
2438,the legend of the lone ranger,William A. FrakerRichard FarnsworthAction Adventure WesternJason RobardsMichael Horse
2439,the tailor of panama,John BoormanJamie Lee CurtisDrama ThrillerDaniel RadcliffeMark Margolis
2440,blow out,Brian De PalmaDennis FranzMystery ThrillerNancy AllenJohn McMartin
2441,getaway,Courtney SolomonPaul FreemanAction Crime ThrillerRebecca BudigBruce Payne
2442,the ice storm,Ang LeeKate BurtonDramaJoan AllenHenry Czerny
2443,and so it goes,Rob ReinerAnnie ParisseComedy Drama RomanceYaya DaCostaFrankie Valli
2444,troop beverly hills,Jeff KanewShelley LongAdventure ComedyCraig T. NelsonKellie Martin
2445,being julia,István SzabóShaun EvansComedy Drama RomanceMiriam MargolyesJuliet Stevenson
2446,9½ weeks,Adrian LyneKaren YoungDrama RomanceDavid MarguliesKim Chan
2447,dragonslayer,Matthew RobbinsRalph RichardsonAction Adventure FantasyIan McDiarmidAlbert Salmi
2448,the last station,Michael HoffmanKerry CondonBiography Drama RomanceDavid MastersonAnne-Marie Duff
2449,ed wood,Tim BurtonBill MurrayBiography Comedy DramaJohnny DeppMartin Landau
2450,labor day,Jason ReitmanKate WinsletDramaJ.K. SimmonsBrooke Smith
2451,mongol: the rise of genghis khan,Sergey BodrovKhulan ChuluunAdventure Biography Drama History WarTadanobu AsanoHonglei Sun
2452,rocknrolla,Guy RitchieGerard ButlerAction Crime ThrillerTom HardyTom Wilkinson
2453,megaforce,Hal NeedhamMichael BeckAction Sci-FiBarry BostwickHenry Silva
2454,hamlet,Kenneth BranaghBrian BlessedDramaJulie ChristieRichard Briers
2455,mao's last dancer,Bruce BeresfordSuzie SteenBiography Drama Music RomanceBruce GreenwoodAden Young
2456,midnight special,Jeff NicholsSam ShepardAdventure Drama Sci-Fi ThrillerKirsten DunstPaul Sparks
2457,anything else,Woody AllenStockard ChanningComedy RomanceWoody AllenFisher Stevens
2458,the railway man,Jonathan TeplitzkyColin FirthBiography Drama Romance WarJeremy IrvineSam Reid
2459,unforgettable            ,unknownDylan WalshDrama MysteryPoppy MontgomeryDallas Roberts
2460,the white ribbon,Michael HanekeBurghart KlaußnerDrama MysteryUlrich TukurLeonie Benesch
2461,restoration,Zack WardAnna HarrHorrorZack WardJames Cullen Bressack
2462,the wraith,Mike MarvinRandy QuaidAction Horror Romance Sci-Fi ThrillerClint HowardNick Cassavetes
2463,the salton sea,D.J. CarusoMeat LoafCrime Drama Mystery ThrillerAdam GoldbergAnthony LaPaglia
2464,metallica through the never,Nimród AntalMackenzie GrayMusicJames HetfieldLars Ulrich
2465,the informers,Gregor JordanBrad RenfroCrime Drama ThrillerAustin NicholsLou Taylor Pucci
2466,carlos            ,unknownNora von WaldstättenBiography Crime Drama ThrillerEdgar RamírezKatharina Schüttler
2467,i come with the rain,Tran Anh HungSimón AndreuThrillerTakuya KimuraShawn Yue
2468,one man's hero,Lance HoolJoaquim de AlmeidaAction Drama History Romance War WesternTom BerengerMark Moses
2469,day of the dead,George A. RomeroJohn AmplasHorrorGreg NicoteroJoseph Pilato
2470,i am wrath,Chuck RussellRebecca De MornayAction Crime Drama ThrillerSam TrammellAmanda Schull
2471,renaissance,Christian VolckmanCatherine McCormackAction Animation Sci-Fi ThrillerRomola GaraiKevork Malikyan
2472,forsaken,Jon CassarLandon LiboironDrama WesternDemi MooreMichael Wincott
2473,red sonja,Richard FleischerBrigitte NielsenAction Adventure FantasyErnie Reyes Jr.Sandahl Bergman
2474,red lights,Rodrigo CortésToby JonesDrama Horror Mystery ThrillerRobert De NiroCraig Roberts
2475,superbad,Greg MottolaJoe Lo TruglioComedyEmma StoneKevin Corrigan
2476,madea goes to jail,Tyler PerryKeshia Knight PulliamComedy Crime DramaVanessa FerlitoDerek Luke
2477,wolves,David HayterJennifer HaleAction HorrorJason MomoaStephen McHattie
2478,step up 2: the streets,Jon M. ChuMari KodaDrama Music Musical RomanceCassie VenturaLuis Rosado
2479,hoodwinked!,Cory EdwardsChazz PalminteriAction Animation Comedy Crime FamilyAnne HathawayJim Belushi
2480,hotel rwanda,Terry GeorgeSophie OkonedoDrama History WarDon CheadleHakeem Kae-Kazim
2481,hitman,Xavier GensDougray ScottAction Crime Drama ThrillerHenry Ian CusickUlrich Thomsen
2482,black nativity,Kasi LemmonsMary J. BligeDrama Family Music MusicalJennifer HudsonVondie Curtis-Hall
2483,the prince,Brian A Miller50 CentAction ThrillerBruce WillisJessica Lowndes
2484,city of ghosts,Matt DillonShawn AndrewsCrime Drama ThrillerKirk FoxRob Campbell
2485,the others,Alejandro AmenábarElaine CassidyFantasy Horror ThrillerFionnula FlanaganEric Sykes
2486,aliens,James CameronCarrie HennAction Adventure Sci-FiMichael BiehnJenette Goldstein
2487,my fair lady,George CukorRex HarrisonDrama Family Musical RomanceJeremy BrettTheodore Bikel
2488,i know what you did last summer,Jim GillespieSarah Michelle GellarHorror Mystery ThrillerMuse WatsonAnne Heche
2489,let's be cops,Luke GreenfieldDamon Wayans Jr.ComedyRob RiggleJames D'Arcy
2490,sideways,Alexander PaynePatrick GallagherAdventure Comedy Drama RomanceVirginia MadsenM.C. Gainey
2491,beerfest,Jay ChandrasekharOwain YeomanComedyChris MossJay Chandrasekhar
2492,halloween,John CarpenterDonald PleasenceHorror ThrillerJamie Lee CurtisP.J. Soles
2493,hero,Yimou ZhangTony Chiu Wai LeungAction Adventure HistoryJet LiMaggie Cheung
2494,good boy!,John HoffmanMolly ShannonComedy Drama Family Fantasy Sci-FiLiam AikenKevin Nealon
2495,the best man holiday,Malcolm D. LeeSanaa LathanComedy DramaHarold PerrineauEddie Cibrian
2496,smokin' aces,Joe CarnahanCommonAction Crime Drama ThrillerRyan ReynoldsAlex Rocco
2497,saw 3d: the final chapter,Kevin GreutertGina HoldenHorror MysteryCostas MandylorBetsy Russell
2498,40 days and 40 nights,Michael LehmannVinessa ShawComedy RomanceEmmanuelle VaugierPaulo Costanzo
2499,tron: legacy,Joseph KosinskiOlivia WildeAction Adventure Sci-FiJeff BridgesJames Frain
2500,a night at the roxbury,John FortenberryChris KattanComedy Music RomanceWill FerrellDan Hedaya
2501,beastly,Daniel BarnzMary-Kate OlsenDrama Fantasy RomanceAlex PettyferErik Knudsen
2502,the hills have eyes,Alexandre AjaGreg NicoteroHorrorDan ByrdVinessa Shaw
2503,dickie roberts: former child star,Sam WeismanJenna BoydComedyKevin GreviouxMary McCormack
2504,"mcfarland, usa",Niki CaroValente RodriguezBiography Drama SportMorgan SaylorDiana Maria Riva
2505,lottery ticket,Erik WhiteLoretta DevineComedyBrandon T. JacksonShad Moss
2506,atl,Chris RobinsonAdam BoyerComedy Crime Drama Music RomanceT.I.Malika
2507,pitch perfect,Jason MooreHana Mae LeeComedy Music RomanceAnna KendrickBen Platt
2508,summer catch,Michael TollinBrian DennehyComedy Drama Romance SportMarc BlucasBruce Davison
2509,a simple plan,Sam RaimiBridget FondaCrime Drama ThrillerGary ColeChelcie Ross
2510,they,Robert HarmonEthan EmbryHorror Mystery ThrillerAlexander GouldMarc Blucas
2511,larry the cable guy: health inspector,Trent CooperLarry the Cable GuyComedy RomanceThomas F. WilsonMegyn Price
2512,the adventures of elmo in grouchland,Gary HalvorsonKevin ClashAdventure Comedy Family Fantasy MusicalVanessa WilliamsCaroll Spinney
2513,brooklyn's finest,Antoine FuquaLili TaylorCrime Drama ThrillerDon CheadleArmando Riesco
2514,55 days at peking,Nicholas RayDavid NivenAction Adventure Drama History WarAva GardnerJohn Ireland
2515,evil dead,Fede AlvarezElizabeth BlackmoreHorrorLou Taylor PucciEllen Sandweiss
2516,my life in ruins,Donald PetrieHarland WilliamsComedy RomanceNia VardalosRachel Dratch
2517,american dreamz,Paul WeitzDennis QuaidComedy MusicJudy GreerChris Klein
2518,superman iv: the quest for peace,Sidney J. FurieMargot KidderAction Adventure Family Sci-FiJim BroadbentWilliam Hootkins
2519,how she move,Ian Iqbal RashidClé BennettDramaDeRay DavisConrad Coates
2520,running scared,Wayne KramerChazz PalminteriAction Crime Drama ThrillerPaul WalkerIvana Milicevic
2521,bobby jones: stroke of genius,Rowdy HerringtonJeremy NorthamBiography Drama Romance SportAidan QuinnPaul Freeman
2522,shanghai surprise,Jim GoddardPaul FreemanAdventure Crime Drama RomanceVictor WongClyde Kusatsu
2523,the illusionist,Neil BurgerEddie MarsanDrama Mystery Romance ThrillerRufus SewellJake Wood
2524,roar,Noel MarshallMelanie GriffithAdventure Horror ThrillerTippi HedrenZakes Mokae
2525,veronica guerin,Joel SchumacherDavid MurrayBiography Crime Drama ThrillerBrenda FrickerGerard McSorley
2526,escobar: paradise lost,Andrea Di StefanoBrady CorbetCrime Drama Romance ThrillerJosh HutchersonCarlos Bardem
2527,southland tales,Richard KellyCurtis ArmstrongComedy Mystery Sci-Fi ThrillerJaneane GarofaloChris Andrew Ciulla
2528,dragon hunters,Guillaume IvernelJess HarnellAdventure Animation Family FantasyRob PaulsenMary Mouser
2529,damnation alley,Jack SmightJan-Michael VincentSci-FiGeorge PeppardPaul Winfield
2530,the apparition,Todd LincolnRick GomezHorror ThrillerJulianna GuillTim Williams
2531,my girl,Howard ZieffJamie Lee CurtisComedy Drama Family RomanceMacaulay CulkinGriffin Dunne
2532,fur: an imaginary portrait of diane arbus,Steven ShainbergTy BurrellBiography Drama RomanceRobert Downey Jr.Matt Servitto
2533,the illusionist,Neil BurgerEddie MarsanDrama Mystery Romance ThrillerRufus SewellJake Wood
2534,wall street,Oliver StoneTamara TunieCrime DramaHal HolbrookJames Karen
2535,sense and sensibility,Ang LeeKate WinsletDrama RomanceAlan RickmanTom Wilkinson
2536,becoming jane,Julian JarroldJulie WaltersBiography Drama RomanceAnne HathawayLaurence Fox
2537,sydney white,Joe NussbaumMatt LongComedy RomanceDanny StrongSamm Levine
2538,house of sand and fog,Vadim PerelmanKim DickensDramaFrances FisherRon Eldard
2539,dead poets society,Peter WeirJosh CharlesComedy DramaRobin WilliamsKurtwood Smith
2540,dumb & dumber,Peter FarrellyMike StarrComedyLauren HollyTeri Garr
2541,when harry met sally...,Rob ReinerGretchen PalmerComedy Drama RomanceBruno KirbyHarley Jane Kozak
2542,the verdict,Sidney LumetJames MasonDramaCharlotte RamplingJack Warden
2543,road trip,Todd PhillipsRachel BlanchardComedyEthan SupleePaulo Costanzo
2544,varsity blues,Brian RobbinsRon LesterComedy Drama Romance SportPaul WalkerMark Walters
2545,the artist,Michel HazanaviciusEd LauterComedy Drama RomanceBérénice BejoBeth Grant
2546,the unborn,David S. GoyerAtticus ShafferDrama Fantasy Horror Mystery ThrillerGary OldmanRachel Brosnahan
2547,moonrise kingdom,Wes AndersonBill MurrayAdventure Comedy Drama RomanceBruce WillisBob Balaban
2548,the texas chainsaw massacre: the beginning,Jonathan LiebesmanJordana BrewsterHorrorMatt BomerLew Temple
2549,the young messiah,Cyrus NowrastehVincent WalshDramaClive RussellFinn Ireland
2550,the master of disguise,Perry Andelin BlakeKenan ThompsonComedy FamilyJennifer EspositoJames Brolin
2551,pan's labyrinth,Guillermo del ToroMaribel VerdúDrama Fantasy WarIvana BaqueroSergi López
2552,the messengers            ,unknownJessika VanDrama Fantasy Mystery ThrillerJoel CourtneyRiley Smith
2553,see spot run,John WhitesellAngus T. JonesAction Comedy Crime FamilyLeslie BibbPaul Sorvino
2554,baby boy,John SingletonSnoop DoggCrime Drama Romance ThrillerMo'NiqueAngell Conwell
2555,the roommate,Christian E. ChristiansenDanneel AcklesDrama Horror ThrillerLeighton MeesterFrances Fisher
2556,joe dirt,Dennie GordonErik Per SullivanAdventure Comedy DramaBrittany DanielFred Ward
2557,double impact,Sheldon LettichAlonna ShawAction CrimeBolo YeungKamel Krifa
2558,hot fuzz,Edgar WrightJoe CornishAction Comedy MysteryBill BaileyBillie Whitelaw
2559,the women,Diane EnglishDebi MazarComedy DramaJada Pinkett SmithDebra Messing
2560,vicky cristina barcelona,Woody AllenKevin DunnDrama RomanceScarlett JohanssonChristopher Evan Welch
2561,arn: the knight templar,Peter FlinthMichael NyqvistAction Adventure Drama Romance WarGustaf SkarsgårdVincent Perez
2562,bad moms,Jon LucasJay HernandezComedyMila KunisJada Pinkett Smith
2563,boys and girls,Robert IscoveAmanda DetmerComedy Drama RomanceAlyson HanniganTsianina Joelson
2564,white oleander,Peter KosminskyCole HauserDramaPatrick FugitMarc Donato
2565,jennifer's body,Karyn KusamaAmy SedarisComedy Fantasy HorrorJ.K. SimmonsCynthia Stevenson
2566,drowning mona,Nick GomezJamie Lee CurtisComedy Crime MysteryWill FerrellTracey Walter
2567,radio days,Woody AllenDon PardoComedyMike StarrJulie Kavner
2568,left behind,Vic ArmstrongLea ThompsonAction Drama Fantasy Mystery ThrillerNicolas CageQuinton Aaron
2569,remember me,Allen CoulterLena OlinDrama RomanceRobert PattinsonRuby Jerins
2570,how to deal,Clare KilnerAlexandra HoldenComedy Drama RomanceDylan BakerTrent Ford
2571,my stepmother is an alien,Richard BenjaminAlyson HanniganComedy Romance Sci-FiJon LovitzTony Jay
2572,philadelphia,Jonathan DemmeTom HanksDramaDenzel WashingtonJason Robards
2573,the thirteenth floor,Josef RusnakCraig BierkoMystery Sci-Fi ThrillerGretchen MolBrad William Henke
2574,the cookout,Lance RiveraVincent PastoreComedyFarrah FawcettJenifer Lewis
2575,meteor,Ronald NeameKarl MaldenAction Drama Sci-Fi ThrillerMartin LandauBrian Keith
2576,duets,Bruce PaltrowMarian SeldesComedy Drama MusicLochlyn MunroHuey Lewis
2577,hollywood ending,Woody AllenDebra MessingComedy RomanceWoody AllenTreat Williams
2578,detroit rock city,Adam RifkinLin ShayeComedy MusicNatasha LyonneShannon Tweed
2579,highlander,Russell MulcahyJon PolitoAction Adventure FantasyChristopher LambertCelia Imrie
2580,things we lost in the fire,Susanne BierOmar Benson MillerDramaAlison LohmanRobin Weigert
2581,steel,Kenneth JohnsonAnnabeth GishAction Crime Sci-FiCharles NapierHill Harper
2582,the immigrant,James GrayDagmara DominczykDrama RomanceJeremy RennerAngela Sarafyan
2583,the white countess,James IvoryNatasha RichardsonDrama History Romance WarVanessa RedgraveLynn Redgrave
2584,trance,Danny BoyleSpencer WildingCrime Drama Mystery ThrillerRosario DawsonTuppence Middleton
2585,soul plane,Jessy TerreroSnoop DoggComedyMo'NiqueTom Arnold
2586,welcome to the sticks,Dany BoonKad MeradComedy RomanceDany BoonMichel Galabru
2587,good,Vicente AmorimJodie WhittakerDrama Romance WarViggo MortensenSteven Mackintosh
2588,enter the void,Gaspar NoéEmily Alyn LindDrama FantasyPaz de la HuertaOlly Alexander
2589,vamps,Amy HeckerlingJustin KirkComedy Horror RomanceTaylor NegronIvan Sergei
2590,hachi: a dog's tale,Lasse HallströmSarah RoemerDrama FamilyCary-Hiroyuki TagawaJoan Allen
2591,zulu,Jérôme SalleTanya van GraanCrime Drama ThrillerOrlando BloomConrad Kemp
2592,the homesman,Tommy Lee JonesTim Blake NelsonDrama WesternBarry CorbinMiranda Otto
2593,juwanna mann,Jesse VaughanJenifer LewisComedy Drama Romance SportVivica A. FoxKevin Pollak
2594,lilyhammer            ,unknownTrond FausaComedy Crime DramaSteven Van ZandtTommy Karlsen
2595,ararat,Atom EgoyanMarie-Josée CrozeDrama WarDavid AlpayCharles Aznavour
2596,madison,William BindleyJake LloydDrama SportBruce DernWilliam Shockley
2597,slow burn,Wayne BeachLL Cool JDrama Mystery ThrillerMekhi PhiferFisher Stevens
2598,wasabi,Gérard KrawczykRyôko HirosueAction Comedy Crime Drama ThrillerCarole BouquetMichel Muller
2599,slither,James GunnGregg HenryComedy Horror Sci-FiDustin MilliganTania Saulnier
2600,beverly hills cop,Martin BrestRonny CoxAction Comedy CrimeJudge ReinholdJames Russo
2601,home alone,Chris ColumbusDevin RatrayComedy FamilyMacaulay CulkinCatherine O'Hara
2602,3 men and a baby,Leonard NimoyTed DansonComedy Drama FamilyTom SelleckSteve Guttenberg
2603,tootsie,Sydney PollackSydney PollackComedy Drama RomanceBill MurrayTeri Garr
2604,top gun,Tony ScottTom SkerrittAction Drama RomanceTom CruiseAdrian Pasdar
2605,"crouching tiger, hidden dragon",Ang LeePei-Pei ChengAction Drama RomanceChen ChangSihung Lung
2606,american beauty,Sam MendesPeter GallagherDramaKevin SpaceyAra Celi
2607,the king's speech,Tom HooperJennifer EhleBiography Drama History RomanceColin FirthDerek Jacobi
2608,twins,Ivan ReitmanTony JayComedy CrimeKelly PrestonHugh O'Brian
2609,scream: the tv series            ,unknownBobby CampoCrime Drama Horror Mystery ThrillerBex Taylor-KlausJason Wiles
2610,the yellow handkerchief,Udayan PrasadEddie RedmayneDrama RomanceKristen StewartWilliam Hurt
2611,the color purple,Steven SpielbergRae Dawn ChongDramaOprah WinfreyDana Ivey
2612,tidal wave,JK YounJi-won HaAction Comedy Drama ThrillerNicole DionneKyung-gu Sol
2613,ben-hur,Timur BekmambetovAyelet ZurerAdventure Drama HistoryMorgan FreemanMoises Arias
2614,the imitation game,Morten TyldumRory KinnearBiography Drama Thriller WarBenedict CumberbatchAllen Leech
2615,private benjamin,Howard ZieffAlbert BrooksComedy WarEileen BrennanAlan Oppenheimer
2616,coal miner's daughter,Michael AptedBeverly D'AngeloBiography Drama Music MusicalSissy SpacekLevon Helm
2617,diary of a wimpy kid,Thor FreudenthalZachary GordonComedy FamilyChloë Grace MoretzRachael Harris
2618,mama,Andrés MuschiettiMegan CharpentierFantasy HorrorJavier BotetIsabelle Nélisse
2619,halloween,John CarpenterDonald PleasenceHorror ThrillerJamie Lee CurtisP.J. Soles
2620,national lampoon's vacation,Harold RamisRandy QuaidAdventure ComedyBeverly D'AngeloJane Krakowski
2621,bad grandpa,Jeff TremaineGeorgina CatesComedyJackson NicollGrasie Mercedes
2622,the queen,Stephen FrearsSylvia SymsBiography DramaRoger AllamAlex Jennings
2623,beetlejuice,Tim BurtonJeffrey JonesComedy FantasyCatherine O'HaraGlenn Shadix
2624,why did i get married?,Tyler PerryTasha SmithComedy DramaMichael Jai WhiteLamman Rucker
2625,little women,Gillian ArmstrongKirsten DunstDrama Family RomanceChristian BaleEric Stoltz
2626,the woman in black,James WatkinsRoger AllamDrama Fantasy Horror ThrillerDaniel RadcliffeJessica Raine
2627,when a stranger calls,Simon WestTessa ThompsonHorror ThrillerMadeline CarrollBrian Geraghty
2628,big fat liar,Shawn LevyDonald FaisonAdventure Comedy FamilyFrankie MunizLee Majors
2629,the deer hunter,Michael CiminoMeryl StreepDrama WarRobert De NiroJohn Savage
2630,wag the dog,Barry LevinsonKirsten DunstComedy DramaRobert De NiroJohn Michael Higgins
2631,the lizzie mcguire movie,Jim FallAdam LambergAdventure Comedy Family Music RomanceClayton SnyderAlex Borstein
2632,snitch,Ric Roman WaughHarold PerrineauAction Drama ThrillerDwayne JohnsonNadine Velazquez
2633,krampus,Michael DoughertyConchata FerrellComedy Fantasy HorrorAdam ScottAllison Tolman
2634,the faculty,Robert RodriguezSalma HayekHorror Mystery Sci-FiJordana BrewsterClea DuVall
2635,what's love got to do with it,Brian GibsonVirginia CapersBiography Drama MusicRae'Ven KellyDororthy Thorton
2636,cop land,James MangoldSylvester StalloneCrime Drama ThrillerRobert De NiroJaneane Garofalo
2637,not another teen movie,Joel GallenJoAnna Garcia SwisherComedyChris EvansMia Kirshner
2638,end of watch,David AyerAnna KendrickCrime Drama ThrillerJake GyllenhaalAmerica Ferrera
2639,aloha,Cameron CroweBradley CooperComedy Drama RomanceEmma StoneBill Murray
2640,the skulls,Rob CohenLeslie BibbAction Crime Drama ThrillerPaul WalkerWilliam Petersen
2641,the theory of everything,James MarshEmily WatsonBiography Drama RomanceEddie RedmayneSimon McBurney
2642,malibu's most wanted,John WhitesellRegina HallComedy CrimeGreg GrunbergBlair Underwood
2643,where the heart is,Matt WilliamsJames FrainComedy Drama RomanceNatalie PortmanStockard Channing
2644,lawrence of arabia,David LeanJosé FerrerAdventure Biography Drama History WarClaude RainsJack Hawkins
2645,halloween ii,Rob ZombieTyler ManeHorrorScout Taylor-ComptonMargot Kidder
2646,wild,Jean-Marc ValléeKevin RankinAdventure Biography DramaMichiel HuismanGaby Hoffmann
2647,the last house on the left,Dennis IliadisMonica PotterCrime Horror ThrillerTony GoldwynMartha MacIsaac
2648,the wedding date,Clare KilnerDebra MessingComedy RomanceJack DavenportHolland Taylor
2649,halloween: resurrection,Rick RosenthalThomas Ian NicholasComedy Horror ThrillerJamie Lee CurtisBianca Kajlich
2650,clash of the titans,Louis LeterrierJason FlemyngAction Adventure FantasyLiam NeesonAlexa Davalos
2651,the princess bride,Rob ReinerCarol KaneAdventure Family Fantasy RomanceRobin WrightAndré the Giant
2652,the great debaters,Denzel WashingtonJurnee Smollett-BellBiography DramaDenzel WashingtonJohn Heard
2653,drive,Nicolas Winding RefnAlbert BrooksCrime DramaRyan GoslingRuss Tamblyn
2654,confessions of a teenage drama queen,Sara SugarmanCarol KaneComedy Family Music RomanceAdam GarciaGlenne Headly
2655,the object of my affection,Nicholas HytnerTim DalyComedy Drama RomanceLiam AikenKali Rocha
2656,28 weeks later,Juan Carlos FresnadilloHarold PerrineauDrama Horror Sci-FiJeremy RennerCatherine McCormack
2657,when the game stands tall,Thomas CarterMatthew DaddarioDrama Family SportJessie T. UsherSer'Darius Blain
2658,because of winn-dixie,Wayne WangLuke BenwardComedy Drama FamilyCicely TysonEva Marie Saint
2659,love & basketball,Gina Prince-BythewoodSanaa LathanDrama Romance SportAlfre WoodardOmar Epps
2660,grosse pointe blank,George ArmitageMichael CudlitzAction Comedy Crime Romance ThrillerMinnie DriverMitchell Ryan
2661,all about steve,Phil TraillKaty MixonComedy RomanceBradley CooperBeth Grant
2662,book of shadows: blair witch 2,Joe BerlingerErica LeerhsenAdventure Fantasy Horror Mystery ThrillerKim DirectorKurt Loder
2663,the craft,Andrew FlemingRachel TrueDrama Fantasy Horror ThrillerChristine TaylorBrenda Strong
2664,match point,Woody AllenMark GatissDrama Romance ThrillerScarlett JohanssonPenelope Wilton
2665,ramona and beezus,Elizabeth Allen RosenbaumHutch DanoAdventure Comedy Family FantasySierra McCormickJason Spevack
