,movie_title,total
3776,90 minutes in heaven,Michael PolishBobby BatsonDramaHayden ChristensenCynthia Barrett
3777,everything must go,Dan RushScott TakedaComedy DramaWill FerrellStephen Root
3778,zero effect,Jake KasdanRyan O'NealComedy Crime Drama Mystery ThrillerKim DickensAngela Featherstone
3779,the machinist,Brad AndersonJennifer Jason LeighDrama ThrillerChristian BaleReg E. Cathey
3780,light sleeper,Paul SchraderJane AdamsCrime DramaDana DelanyDavid Clennon
3781,kill the messenger,Michael CuestaPaz VegaBiography Crime Drama Mystery ThrillerJeremy RennerRobert Pralgo
3782,rabbit hole,John Cameron MitchellJon TenneyDramaDianne WiestTammy Blanchard
3783,party monster,Fenton BaileyMia KirshnerBiography Crime Drama ThrillerMacaulay CulkinMarilyn Manson
3784,green room,Jeremy SaulnierMark WebberCrime Horror Music ThrillerAlia ShawkatJoe Cole
3785,the oh in ohio,Billy KentTim RussComedy Drama RomanceLiza MinnelliWinter Ave Zoli
3786,atlas shrugged: who is john galt?,James ManeraGreg GermannDrama Mystery Sci-FiJoaquim de AlmeidaKristoffer Polaha
3787,bottle rocket,Wes AndersonDarryl CoxComedy Crime DramaAndrew WilsonLumi Cavazos
3788,albino alligator,Kevin SpaceyJoe MantegnaCrime Drama ThrillerViggo MortensenFaye Dunaway
3789,"gandhi, my father",Feroz Abbas KhanBhoomika ChawlaBiography Drama HistoryAkshaye KhannaDarshan Jariwala
3790,standard operating procedure,Errol MorrisMegan Ambuhl GranerCrime Documentary WarJeffrey FrostKen Davis
3791,out of the blue,Dennis HopperDon GordonDramaRaymond BurrJim Byrnes
3792,tucker and dale vs evil,Eli CraigTyler LabineComedy HorrorKatrina BowdenChelan Simmons
3793,"lovely, still",Nicholas FacklerEllen BurstynDrama RomanceAdam ScottMartin Landau
3794,tycoon,Richard WallacePaul FixAdventure Drama RomanceJudith AndersonLaraine Day
3795,desert blue,Morgan J. FreemanJohn HeardDramaEthan SupleeSara Gilbert
3796,decoys,Matthew HastingsMarc TrottierComedy Horror Sci-FiMeghan OryCorey Sevier
3797,the visit,M. Night ShyamalanPatch DarraghHorror ThrillerOcean JamesOlivia DeJonge
3798,redacted,Brian De PalmaDaniel Stewart ShermanCrime Thriller WarMike FigueroaKel O'Neill
3799,fascination,Klaus MenzelJacqueline BissetMystery Romance ThrillerAdam GarciaAlice Evans
3800,saving grace            ,unknownDylan MinnetteDrama FantasyHolly HunterBokeem Woodbine
3801,area 51,Oren PeliSandra StaggsHorror Sci-Fi ThrillerGlenn CampbellJelena Nik
3802,sleep tight,Jaume BalagueróTony CorvilloDrama Horror ThrillerLuis TosarMarta Etura
3803,the cottage,Paul Andrew WilliamsDoug BradleyComedy Crime Horror ThrillerDave LegenoGeorgia Groome
3804,dead like me: life after death,Stephen HerekCallum BlueComedy Drama FantasyHenry Ian CusickShenae Grimes-Beech
3805,farce of the penguins,Bob SagetJohn StamosAnimation ComedyAlyson HanniganJim Belushi
3806,flying by,Jim AmatulliPatricia NealDrama Family MusicHeather LocklearKatie Leclerc
3807,psych            ,unknownDulé HillComedy Crime MysteryCorbin BernsenTimothy Omundson
3808,rudderless,William H. MacyFelicity HuffmanComedy Drama MusicBilly CrudupDavid Adam Flannery
3809,henry & me,Barrett EspositoCyndi LauperAnimation FamilyChazz PalminteriDanny Aiello
3810,christmas eve,Mitch DavisJon HederComedyGary ColeCheryl Hines
3811,we have your husband,Eric BrossEsai MoralesCrime Drama ThrillerTeri PoloNicholas Gonzalez
3812,dying of the light,Paul SchraderIrène JacobDrama ThrillerNicolas CageTomiwa Edun
3813,born of war,Vicky JewsonSofia Black-D'EliaAction Drama Thriller WarJames FrainLisa Kay
3814,capricorn one,Peter HyamsSam WaterstonAction Sci-Fi ThrillerDavid HuddlestonHal Holbrook
3815,should've been romeo,Marc BennettNatasha HenstridgeComedy DramaMichael RapaportCostas Mandylor
3816,running forever,Mike MayhallCody HowardFamilyDavid RaizorMartin Kove
3817,yoga hosers,Kevin SmithHaley Joel OsmentComedy Fantasy Horror ThrillerJohnny DeppNatasha Lyonne
3818,navy seals vs. zombies,Stanton BarrettMichael DudikoffAction HorrorMikal VegaEd Quinn
3819,i served the king of england,Jirí MenzelIvan BarnevComedy Drama Romance WarJulia JentschMilan Lasica
3820,soul kitchen,Fatih AkinMoritz BleibtreuComedy DramaUdo KierBirol Ünel
3821,sling blade,Billy Bob ThorntonDwight YoakamDramaRobert DuvallJ.T. Walsh
3822,the awakening,Nick MurphyImelda StauntonHorror ThrillerIsaac Hempstead WrightJoseph Mawle
3823,hostel,Eli RothTakashi MiikeHorrorJay HernandezRick Hoffman
3824,tristram shandy: a cock and bull story,Michael WinterbottomShirley HendersonComedy DramaSteve CooganDylan Moran
3825,take shelter,Jeff NicholsShea WhighamDrama ThrillerKaty MixonRobert Longstreet
3826,lady in white,Frank LaLoggiaLukas HaasFantasy Horror Mystery ThrillerAlex RoccoKatherine Helmond
3827,driving lessons,Jeremy BrockJulie WaltersComedy DramaRupert GrintTamsin Egerton
3828,let's kill ward's wife,Scott FoleyGreg GrunbergComedy CrimeDonald FaisonDagmara Dominczyk
3829,the texas chainsaw massacre 2,Tobe HooperLou PerrymanComedy HorrorBill JohnsonJim Siedow
3830,pat garrett & billy the kid,Sam PeckinpahBob DylanBiography Drama Romance WesternJames CoburnJason Robards
3831,only god forgives,Nicolas Winding RefnKristin Scott ThomasCrime DramaRyan GoslingYayaying Rhatha Phongam
3832,camping sauvage,Christophe AliIsild Le BescoDramaDenis LavantEmmanuelle Bercot
3833,without men,Gabriela TagliaviniKate del CastilloComedyMaria Conchita AlonsoCamryn Manheim
3834,barfi,ShekarDiganthComedy RomanceBhamaDileep Raj
3835,dear frankie,Shona AuerbachSharon SmallDrama RomanceGerard ButlerJack McElhone
3836,all hat,Leonard FarlingerGary FarmerWesternKeith CarradineStephen McHattie
3837,the names of love,Michel LeclercJacques GamblinComedy Drama RomanceSara ForestierZinedine Soualem
3838,treading water,Analeine Cal y MayorDouglas SmithComedy DramaZoë KravitzKim Ly
3839,savage grace,Tom KalinElena AnayaDramaEddie RedmayneStephen Dillane
3840,out of the blue,Robert SarkiesMatthew SunderlandCrime DramaWilliam KircherPaul Glover
3841,police academy,Hugh WilsonBubba SmithComedySteve GuttenbergMichael Winslow
3842,the blue lagoon,Randal KleiserChristopher AtkinsAdventure Drama RomanceBrooke ShieldsLeo McKern
3843,four weddings and a funeral,Mike NewellJames FleetComedy Drama RomanceKristin Scott ThomasSimon Callow
3844,fast times at ridgemont high,Amy HeckerlingJudge ReinholdComedy DramaJennifer Jason LeighVincent Schiavelli
3845,moby dick,John HustonRichard BasehartAdventure DramaRoyal DanoJames Robertson Justice
3846,25th hour,Spike LeeRosario DawsonDramaPhilip Seymour HoffmanAaron Stanford
3847,secrets and lies            ,unknownIndiana EvansCrime DramaDan FoglerKaDee Strickland
3848,bound,Lana WachowskiKevin Michael RichardsonCrime Drama Romance ThrillerChristopher MeloniPeter Spellos
3849,requiem for a dream,Darren AronofskyMark MargolisDramaEllen BurstynLouise Lasser
3850,state fair,Walter LangJeanne CrainMusical RomanceDana AndrewsFrank McHugh
3851,tango,Carlos SauraJuan Luis GaliardoDrama MusicalMía MaestroMiguel Ángel Solá
3852,salvador,Oliver StoneJohn SavageDrama History Thriller WarJim BelushiJuan Fernández
3853,moms' night out,Andrew ErwinSarah DrewComedyAlex KendrickPatricia Heaton
3854,donnie darko,Richard KellyMary McDonnellDrama Sci-Fi ThrillerJake GyllenhaalJames Duval
3855,saving private perez,Beto GómezGerardo TaracenaAdventure Comedy WesternJaime CamilJoaquín Cosio
3856,character,Mike van DiemFedja van HuêtCrime Drama MysteryJan DecleirHans Kesting
3857,spun,Jonas ÅkerlundNicholas GonzalezComedy Crime DramaPatrick FugitDebbie Harry
3858,life during wartime,Todd SolondzShirley HendersonComedy DramaRich PecciCharlotte Rampling
3859,lady vengeance,Chan-wook ParkYeong-ae LeeCrime DramaMin-sik ChoiHye-jeong Kang
3860,mozart's sister,René FéretClovis FouinBiography Drama Music RomanceNicolas GiraudMarie Féret
3861,mean machine,Barry SkolnickJason FlemyngComedy Drama SportJason StathamDanny Dyer
3862,exiled,Johnnie ToAnthony Chau-Sang WongAction Crime ThrillerSimon YamJosie Ho
3863,blackthorn,Mateo GilDominique McElligottAction Adventure WesternSam ShepardStephen Rea
3864,lilya 4-ever,Lukas MoodyssonArtyom BogucharskiyCrime DramaOksana AkinshinaLyubov Agapova
3865,after.life,Agnieszka Wojtowicz-VoslooJosh CharlesDrama Horror Mystery ThrillerLiam NeesonChandler Canterbury
3866,fugly,Kabir SadanandSana SaeedDrama ThrillerJimmy ShergillDimple Kapadia
3867,one flew over the cuckoo's nest,Milos FormanMichael BerrymanDramaScatman CrothersLouise Fletcher
3868,r.l. stine's monsterville: the cabinet of souls,Peter DeLuiseDove CameronComedyKatherine McNamaraBraeden Lemasters
3869,silent movie,Mel BrooksDom DeLuiseComedy RomanceSid CaesarBernadette Peters
3870,airlift,Raja MenonSameer Ali KhanAction Drama History Thriller WarNimrat KaurPurab Kohli
3871,anne of green gables            ,unknownJonathan CrombieDrama FamilyZack WardMegan Follows
3872,falcon rising,Ernie BarbarashMichael J. MorrisAction AdventureMichael Jai WhiteLateef Crowder
3873,the sweeney,Nick LoveRay WinstoneAction Crime DramaHayley AtwellAlan Ford
3874,sexy beast,Jonathan GlazerJames FoxCrime ThrillerRay WinstoneAmanda Redman
3875,easy money,Daniel EspinosaFares FaresAction Crime Drama ThrillerFabian BolinMatias Varela
3876,whale rider,Niki CaroRawiri ParateneDrama FamilyKeisha Castle-HughesTammy Davis
3877,paa,R. BalkiAbhishek BachchanComedy DramaVidya BalanParesh Rawal
3878,cargo,Ivan EnglerClaude-Oliver RudolphMystery Sci-Fi ThrillerYangzom BrauenAnna Katharina Schwabroh
3879,pan,Joe WrightCara DelevingneAdventure Family FantasyHugh JackmanNonso Anozie
3880,high school musical,Kenny OrtegaCorbin BleuComedy Drama Family Music Musical RomanceLucas GrabeelOlesya Rulin
3881,animal kingdom            ,unknownDaniella AlonsoCrime DramaDorian MissickEllen Barkin
3882,love and death on long island,Richard KwietniowskiMaury ChaykinComedy DramaJason PriestleyDanny Webb
3883,night watch,Timur BekmambetovAleksey ChadovFantasy ThrillerKonstantin KhabenskiyZhanna Friske
3884,the crying game,Neil JordanMiranda RichardsonCrime Drama Romance ThrillerJim BroadbentStephen Rea
3885,porky's,Bob ClarkSusan ClarkComedyArt HindleTony Ganios
3886,survival of the dead,George A. RomeroShawn RobertsHorrorJulian RichingsKathleen Munroe
3887,night of the living dead,George A. RomeroDuane JonesDrama Horror MysteryJudith O'DeaS. William Hinzman
3888,lost in translation,Sofia CoppolaBill MurrayDramaScarlett JohanssonCatherine Lambert
3889,annie hall,Woody AllenCarol KaneComedy RomanceWoody AllenShelley Duvall
3890,the greatest show on earth,Cecil B. DeMilleDorothy LamourDrama Family RomanceGloria GrahameCornel Wilde
3891,exodus: gods and kings,Ridley ScottMaría ValverdeAction Adventure DramaChristian BaleBen Mendelsohn
3892,monster's ball,Marc ForsterPeter BoyleDrama RomanceHeath LedgerMarcus Lyle Brown
3893,maggie,Henry HobsonJ.D. EvermoreDrama HorrorJoely RichardsonDavid A Cole
3894,leaving las vegas,Mike FiggisValeria GolinoDrama RomanceNicolas CageJulian Sands
3895,hansel & gretel get baked,Duane JourneyLara Flynn BoyleComedy HorrorMolly C. QuinnLochlyn Munro
3896,the return of the living dead,Dan O'BannonClu GulagerComedy Horror Sci-FiLinnea QuigleyBeverly Randolph
3897,the front page,Billy WilderHarold GouldComedy Drama RomanceAustin PendletonDavid Wayne
3898,the boy next door,Rob CohenHill HarperMystery ThrillerRyan GuzmanAdam Hicks
3899,trapeze,Carol ReedKaty JuradoDrama RomanceGina LollobrigidaSidney James
3900,saving grace            ,unknownDylan MinnetteDrama FantasyHolly HunterBokeem Woodbine
3901,the kids are all right,Lisa CholodenkoMia WasikowskaComedy DramaJosh HutchersonYaya DaCosta
3902,they live,John CarpenterPeter JasonHorror Sci-Fi ThrillerMeg FosterGeorge 'Buck' Flower
3903,the great escape,John SturgesDonald PleasenceAdventure Drama History Thriller WarJames CoburnGordon Jackson
3904,what the #$*! do we (k)now!?,William ArntzElaine HendrixComedy Documentary Drama Fantasy Mystery Sci-FiMarlee MatlinArmin Shimerman
3905,the last exorcism part ii,Ed Gass-DonnellySpencer Treat ClarkDrama Horror ThrillerMuse WatsonAshley Bell
3906,boyhood,Richard LinklaterLorelei LinklaterDramaEllar ColtraneLibby Villari
3907,scoop,Woody AllenKevin McNallyComedy Crime MysteryScarlett JohanssonGeoff Bell
3908,planet of the apes,Tim BurtonEstella WarrenAction Adventure Sci-Fi ThrillerCary-Hiroyuki TagawaErick Avari
3909,the wash,DJ PoohDr. DreComedyAngell ConwellDJ Pooh
3910,3 strikes,DJ PoohMike EppsComedyMo'NiqueFaizon Love
3911,the cooler,Wayne KramerPaul SorvinoCrime Drama Fantasy RomanceEstella WarrenShawn Hatosy
3912,the misfits,John HustonKevin McCarthyDrama Romance WesternMontgomery CliftThelma Ritter
3913,the night listener,Patrick StettnerJoe MortonCrime Mystery ThrillerRobin WilliamsRory Culkin
3914,the jerky boys,James MelkonianWilliam HickeyComedy CrimeVincent PastorePeter Appel
3915,my soul to take,Wes CravenEmily MeadeHorror Mystery ThrillerFrank GrilloZena Grey
3916,the orphanage,J.A. BayonaBelén RuedaDrama Mystery ThrillerGeraldine ChaplinFernando Cayo
3917,a haunted house 2,Michael TiddesEssence AtkinsComedy FantasyAshley RickardsGabriel Iglesias
3918,the rules of attraction,Roger AvaryFaye DunawayComedy Drama RomanceIan SomerhalderClifton Collins Jr.
3919,topaz,Alfred HitchcockJohn VernonDrama ThrillerRoscoe Lee BrownePhilippe Noiret
3920,let's go to prison,Bob OdenkirkChi McBrideComedy CrimeDylan BakerAmy Hill
3921,four rooms,Allison AndersAlicia WittComedy FantasySalma HayekLili Taylor
3922,secretary,Steven ShainbergStephen McHattieComedy Drama RomanceJeremy DaviesLesley Ann Warren
3923,the real cancun,Rick de OliveiraAlan TaylorDocumentaryLaura RamseyBenjamin Fletcher
3924,talk radio,Oliver StoneZach GrenierDramaMichael WincottBill Johnson
3925,waiting for guffman,Christopher GuestFred WillardComedyCatherine O'HaraLarry Miller
3926,love stinks,Jeff FranklinTyra BanksComedyIvana MilicevicBridgette Wilson-Sampras
3927,you kill me,John DahlAaron HughesComedy Crime Romance ThrillerPhilip Baker HallJayne Eastwood
3928,thumbsucker,Mike MillsLou Taylor PucciComedy DramaKelli GarnerNancy O'Dell
3929,red state,Kevin SmithMichael AngaranoAction Crime Horror ThrillerAnna GunnStephen Root
3930,mirrormask,Dave McKeanGina McKeeAdventure FantasyStephanie LeonidasRob Brydon
3931,samsara,Ron FrickeBalinese Tari Legong DancersDocumentary MusicCollin Alfredo St. DicPuti Sri Candra Dewi
3932,the barbarians,Ruggero DeodatoEva LaRueAdventure FantasyMichael BerrymanRichard Lynch
3933,the art of getting by,Gavin WiesenBlair UnderwoodDrama RomanceMichael AngaranoRita Wilson
3934,zipper,Mora StephensAlexandra BreckenridgeDrama ThrillerRay WinstoneElena Satine
3935,poolhall junkies,Mars CallahanRicky SchroderDrama ThrillerChazz PalminteriErnie Reyes Jr.
3936,the loss of sexual innocence,Mike FiggisSaffron BurrowsDramaKelly MacdonaldJulian Sands
3937,holy motors,Leos CaraxLeos CaraxDrama FantasyKylie MinogueDenis Lavant
3938,joe,David Gordon GreenTye SheridanDramaNicolas CageRonnie Gene Blevins
3939,shooting fish,Stefan SchwartzDan FuttermanComedy Crime RomancePeter McNamaraRalph Ineson
3940,prison,Renny HarlinLane SmithCrime Drama Horror ThrillerViggo MortensenHal Landon Jr.
3941,psycho beach party,Robert Lee KingKathleen RobertsonComedy Horror MysteryLauren AmbroseBeth Broderick
3942,the big tease,Kevin AllenFrances FisherComedyCraig FergusonMary McCormack
3943,"buen día, ramón",Jorge Ramírez SuárezAdriana BarrazaDramaHector KotsifakisArcelia Ramírez
3944,trust,David SchwimmerJordan TrovillionCrime Drama ThrillerNoah EmmerichZoe Levin
3945,an everlasting piece,Barry LevinsonBrían F. O'ByrneComedyAnna FrielPauline McLynn
3946,among giants,Sam MillerAlan WilliamsComedy RomanceRachel GriffithsRob Jarvis
3947,adore,Anne FontaineNaomi WattsDrama RomanceRobin WrightBen Mendelsohn
3948,the velocity of gary,Dan IrelandDanny ArroyoComedy Drama RomanceSalma HayekOlivia d'Abo
3949,mondays in the sun,Fernando León de AranoaEnrique VillénComedy DramaLuis TosarAida Folch
3950,stake land,Jim MickleMichael CerverisDrama Horror Sci-FiConnor PaoloNick Damici
3951,sonny with a chance            ,unknownTiffany ThorntonComedy Family RomanceDoug BrochuBrandon Mychal Smith
3952,the last time i committed suicide,Stephen KayMarg HelgenbergerBiography DramaKeanu ReevesGretchen Mol
3953,futuro beach,Karim AïnouzClemens SchickDramaWagner MouraJesuíta Barbosa
3954,another happy day,Sam LevinsonEzra MillerComedy DramaGeorge KennedyDemi Moore
3955,a lonely place to die,Julian GilbeyEamonn WalkerAction Adventure Crime ThrillerEd SpeleersSean Harris
3956,nothing,Vincenzo NataliAngelo TsarouchasComedy FantasyDavid HewlettMarie-Josée Croze
3957,the geographer drank his globe away,Aleksandr VeledinskiyElena LyadovaAdventure DramaKonstantin KhabenskiyEugenia Khirivskaya
3958,1776,Peter H. HuntKen HowardDrama Family History MusicalBlythe DannerHoward Caine
3959,inescapable,Ruba NaddaBonnie Lee BoumanDrama Mystery Romance ThrillerSaad SiddiquiFadia Nadda
3960,hell's angels,Howard HughesMarian MarshDrama WarJean HarlowJames Hall
3961,purple violets,Edward BurnsRosemarie DeWittComedy Drama RomanceDebra MessingPeter Jacobson
3962,the veil,Phil JoanouShannon WoodwardHorrorLily RabeKira McLean
3963,the loved ones,Sean ByrneJessica McNameeHorror ThrillerRobin McLeavyVictoria Thaine
3964,no vacancy,Chris StokesRachel SterlingHorrorKristen QuintrallBlack Thomas
3965,how to fall in love,Mark GriffithsGina HoldenComedy RomanceEric MabiusBrooke D'Orsay
3966,the perfect wave,Bruce MacdonaldCheryl LaddAdventure Biography Drama RomanceRachel HendrixDiana Vickers
3967,ben-hur,Timur BekmambetovAyelet ZurerAdventure Drama HistoryMorgan FreemanMoises Arias
3968,a man for all seasons,Fred ZinnemannSusannah YorkBiography Drama HistoryRobert ShawPaul Scofield
3969,network,Sidney LumetFaye DunawayDrama RomanceRobert DuvallWilliam Holden
3970,gone with the wind,Victor FlemingGeorge ReevesDrama History Romance WarHattie McDanielThomas Mitchell
3971,desert dancer,Richard RaymondReece RitchieBiography DramaTom CullenMarama Corlett
3972,major dundee,Sam PeckinpahSlim PickensAdventure War WesternJames CoburnWarren Oates
3973,down for life,Alan JacobsLaz AlonsoDramaSnoop DoggNicholas Gonzalez
3974,annie get your gun,George SidneyHoward KeelBiography Comedy Musical Romance WesternKeenan WynnBetty Hutton
3975,four lions,Christopher MorrisRiz AhmedComedy Crime DramaKayvan NovakAlex Macqueen
3976,house of sand,Andrucha WaddingtonSeu JorgeDramaFernanda MontenegroFernanda Torres
3977,defendor,Peter StebbingsTony NappoComedy Crime DramaMichael KellyCharlotte Sullivan
3978,the pirate,Vincente MinnelliReginald OwenAdventure Comedy Musical RomanceGladys CooperEllen Ross
3979,the good heart,Dagur KáriSusan BlommaertDramaAlice Olivia ClarkeStephen Henderson
3980,the history boys,Nicholas HytnerRussell ToveyComedy DramaDominic CooperJames Corden
3981,unknown,Jaume Collet-SerraFrank LangellaAction Mystery ThrillerLiam NeesonAidan Quinn
3982,m*a*s*h            ,unknownJamie FarrComedy Drama WarDavid Ogden StiersMike Farrell
3983,midnight cowboy,John SchlesingerBarnard HughesDramaBrenda VaccaroJohn McGiver
3984,the full monty,Peter CattaneoMark AddyComedy Drama MusicTom WilkinsonLesley Sharp
3985,airplane!,Jim AbrahamsLloyd BridgesComedyPeter GravesBarbara Billingsley
3986,chain of command,Kevin CarrawayMax RyanAction ThrillerMichael Jai WhiteJon Osbeck
3987,friday,F. Gary GrayJohn WitherspoonComedy DramaNia LongTony Cox
3988,menace ii society,Albert HughesLarenz TateCrime Drama ThrillerJada Pinkett SmithKhandi Alexander
3989,empire            ,unknownGabourey SidibeDrama MusicTa'Rhonda JonesMalik Yoba
3990,creepshow 2,Michael GornickHolt McCallanyComedy Fantasy Horror ThrillerGeorge KennedyDorothy Lamour
3991,the ballad of cable hogue,Sam PeckinpahJason RobardsComedy Drama Romance WesternSlim PickensL.Q. Jones
3992,in cold blood,Richard BrooksRobert BlakeBiography Crime Drama HistoryJohn ForsytheWill Geer
3993,the nun's story,Fred ZinnemannPeter FinchDramaColleen DewhurstBeatrice Straight
3994,harper,Jack SmightRobert WagnerAction Crime Drama Mystery ThrillerJanet LeighShelley Winters
3995,frenzy,Alfred HitchcockJean MarshThrillerBernard CribbinsClive Swift
3996,the witch,Robert EggersKate DickieHorror MysteryJulian RichingsRalph Ineson
3997,i got the hook up,Michael MartinMaster PComedyJoe EstevezAnthony Johnson
3998,she's the one,Edward BurnsFrank VincentComedy Drama RomanceJohn MahoneyMichael McGlone
3999,gods and monsters,Bill CondonLynn RedgraveBiography DramaBrendan FraserKevin J. O'Connor
4000,the secret in their eyes,Juan José CampanellaSoledad VillamilDrama Mystery ThrillerRicardo DarínGuillermo Francella
4001,day of the dead,George A. RomeroJohn AmplasHorrorGreg NicoteroJoseph Pilato
4002,train,Gideon RaffGloria VotsisHorror ThrillerGideon EmeryDerek Magyar
4003,evil dead ii,Sam RaimiDan HicksComedy Fantasy Horror ThrillerTed RaimiKassie Wesley DePaiva
4004,pootie tang,Louis C.K.J.B. SmooveAction Adventure Comedy MusicalWanda SykesRobert Vaughn
4005,sharknado,Anthony C. FerranteJohn HeardHorrorIan ZieringCassandra Scerbo
4006,la otra conquista,Salvador CarrascoZaide Silvia GutiérrezDrama HistoryElpidia CarrilloDamián Delgado
4007,trollhunter,André ØvredalJohanna MørckComedy Drama Fantasy HorrorOtto JespersenGlenn Erland Tosterud
4008,ira & abby,Robert CaryFred WillardComedy RomanceFrances ConroyKevin Sussman
4009,the watch,Akiva SchafferNicholas BraunAction Comedy Sci-FiWill ForteRosemarie DeWitt
4010,winter passing,Adam RappWill FerrellComedy DramaZooey DeschanelDallas Roberts
4011,d.e.b.s.,Angela RobinsonGeoff StultsAction Comedy RomanceJordana BrewsterScoot McNairy
4012,the masked saint,Warren P. SonodaMykel Shannon JenkinsAction Biography Crime Drama Family FantasyDiahann CarrollLara Jean Chorostecki
4013,the betrayed,Amanda GusackChristian CampbellCrime Drama Mystery ThrillerAlice KrigeBlaine Anderson
4014,taxman,Avi NesherElizabeth BerkleyAction Comedy Crime ThrillerFisher StevensRobert Townsend
4015,the secret            ,unknownAsh CookDrama ThrillerJames NesbittGenevieve O'Reilly
4016,2:13,Charles AdelmanKevin PollakHorror ThrillerTeri PoloJere Burns
4017,"batman: the dark knight returns, part 2",Jay OlivaMark ValleyAction Animation Crime Sci-Fi ThrillerMichael EmersonGrey Griffin
4018,time to choose,Charles FergusonJerry BrownDocumentaryJane GoodallPeter Agnefjall
4019,in the name of the king: the last job,Uwe BollShelly VarodAction Adventure Fantasy ThrillerBashar RahalRalitsa Paskaleva
4020,wicked blood,Mark YoungJake BuseyAction Crime Drama ThrillerAlexa PenaVegaLew Temple
4021,dawn patrol,Daniel Petrie Jr.Jeff FaheyDrama ThrillerChris BrochuRita Wilson
4022,lords of london,Antonio SimonciniJoe EganCrime Mystery ThrillerRay WinstoneGlen Murphy
4023,high anxiety,Mel BrooksHarvey KormanComedyMadeline KahnDick Van Patten
4024,march of the penguins,Luc JacquetSofie GråbølDocumentaryMorgan FreemanRomane Bohringer
4025,margin call,J.C. ChandorDemi MooreBiography Drama ThrillerKevin SpaceyAshley Williams
4026,august,Eldar RapaportAdrian GonzalezDrama RomanceMurray BartlettEdward Conna
4027,choke,Clark GreggMatt GeraldComedy DramaAnjelica HustonJonah Bobo
4028,whiplash,Damien ChazelleMelissa BenoistDrama MusicJ.K. SimmonsChris Mulkey
4029,city of god,Fernando MeirellesSeu JorgeCrime DramaAlice BragaAlexandre Rodrigues
4030,human traffic,Justin KerriganJohn SimmComedy MusicDanny DyerShaun Parkes
4031,day one,Nathan FrankowskiRus BlackwellBiography Drama MusicCorbin BleuLuis Antonio
4032,the dead girl,Karen MoncrieffBruce DavisonCrime Drama MysteryJames FrancoPiper Laurie
4033,the hunt,Thomas VinterbergAlexandra RapaportDramaThomas Bo LarsenHana Shuan
4034,a christmas story,Bob ClarkDarren McGavinComedy FamilyZack WardScott Schwartz
4035,bella,Alejandro MonteverdeRamon RodriguezDrama RomanceArmando RiescoEduardo Verástegui
4036,class of 1984,Mark L. LesterPerry KingAction Crime Drama ThrillerRoddy McDowallTimothy Van Patten
4037,the opposite sex,Jennifer FinniganKenan ThompsonComedyGeoff StultsJosh Hopkins
4038,dreaming of joseph lees,Eric StylesRupert GravesDrama RomanceSamantha MortonMiriam Margolyes
4039,the class,Laurent CantetAgame Malembo-EmeneDramaFrançois BégaudeauAngélica Sancio
4040,rosemary's baby,Roman PolanskiMia FarrowDrama HorrorJohn CassavetesCharles Grodin
4041,the man who shot liberty valance,John FordWoody StrodeDrama WesternLee MarvinVera Miles
4042,adam,Max MayerTerry WaltersDrama RomancePeter GallagherAmy Irving
4043,maria full of grace,Joshua MarstonWilson GuerreroCrime DramaCatalina Sandino MorenoYenny Paola Vega
4044,beginners,Mike MillsLou Taylor PucciComedy Drama RomanceGoran VisnjicMary Page Keller
4045,feast,John GulagerEric DaneAction Comedy Horror ThrillerKrista AllenHenry Rollins
4046,animal house,John LandisKaren AllenComedyJohn BelushiTim Matheson
4047,goldfinger,Guy HamiltonGert FröbeAction Adventure ThrillerHonor BlackmanLois Maxwell
4048,antiviral,Brandon CronenbergDouglas SmithHorror Sci-Fi ThrillerSarah GadonCaleb Landry Jones
4049,it's a wonderful life,Frank CapraLionel BarrymoreDrama Family Fantasy RomanceDonna ReedThomas Mitchell
4050,trainspotting,Danny BoyleShirley HendersonDramaKelly MacdonaldEwen Bremner
4051,the original kings of comedy,Spike LeeCedric the EntertainerComedy DocumentaryBernie MacSteve Harvey
4052,paranormal activity 2,Tod WilliamsMolly EphraimHorrorSprague GraydenMicah Sloat
4053,waking ned devine,Kirk JonesDavid KellyComedyJames NesbittFionnula Flanagan
4054,bowling for columbine,Michael MooreDick ClarkCrime Documentary DramaMichael MooreBill Clinton
4055,coming home,Yimou ZhangDaoming ChenDramaLi GongNi Yan
4056,a nightmare on elm street 2: freddy's revenge,Jack SholderRobert RuslerFantasy HorrorClu GulagerMarshall Bell
4057,a room with a view,James IvoryRupert GravesDrama RomanceJulian SandsDenholm Elliott
4058,the purge,James DeMonacoAdelaide KaneHorror Sci-Fi ThrillerRhys WakefieldChris Mulkey
4059,sinister,Scott DerricksonVictoria LeighHorror MysteryDanielle KotchJames Ransone
